{
  "schema_version": "1.0.0",
  "ontology_id": "purchase-ontology-l1",
  "title": "Purchase Approval Ontology",
  "domain": "enterprise_procurement",
  "concepts": [
    {
      "id": "concept:purchase_request",
      "name": "Purchase Request",
      "type": "concept",
      "category": "document",
      "attribute_ids": [
        "attr:purchase_request.amount"
      ],
      "evidence_refs": [
        "ev:ddl.purchase_request"
      ],
      "confidence": 0.92
    }
  ],
  "attributes": [
    {
      "id": "attr:purchase_request.amount",
      "concept_id": "concept:purchase_request",
      "name": "amount",
      "type": "attribute",
      "data_type": "decimal",
      "required": true,
      "evidence_refs": [
        "ev:ddl.purchase_request"
      ],
      "confidence": 0.95
    }
  ],
  "relations": [
    {
      "id": "rel:purchase_request.supplier",
      "type": "relation",
      "source_concept_id": "concept:purchase_request",
      "target_concept_id": "concept:supplier",
      "predicate": "selects",
      "cardinality": "many_to_one",
      "evidence_refs": [
        "ev:ddl.purchase_request"
      ],
      "confidence": 0.8
    }
  ],
  "events": [
    {
      "id": "event:purchase_request_submitted",
      "type": "event",
      "name": "Purchase Request Submitted",
      "trigger": "submit action",
      "participant_concept_ids": [
        "concept:purchase_request"
      ],
      "confidence": 0.78
    }
  ],
  "rules": [
    {
      "id": "rule:amount_requires_approval",
      "type": "rule",
      "name": "Amount Requires Approval",
      "condition": "amount > 10000",
      "effect": "manager approval is required",
      "applies_to_ids": [
        "concept:purchase_request"
      ],
      "confidence": 0.75
    }
  ],
  "actions": [
    {
      "id": "action:approve_request",
      "type": "action",
      "name": "Approve Request",
      "actor_role_ids": [
        "role:manager"
      ],
      "target_concept_ids": [
        "concept:purchase_request"
      ]
    }
  ],
  "states": [
    {
      "id": "state:submitted",
      "type": "state",
      "name": "Submitted",
      "owner_concept_id": "concept:purchase_request"
    }
  ],
  "roles": [
    {
      "id": "role:manager",
      "type": "role",
      "name": "Manager"
    }
  ],
  "permissions": [
    {
      "id": "perm:manager.approve_request",
      "type": "permission",
      "role_id": "role:manager",
      "action_id": "action:approve_request",
      "resource_concept_id": "concept:purchase_request",
      "effect": "allow"
    }
  ],
  "aliases": [
    {
      "id": "alias:pr",
      "type": "alias",
      "canonical_id": "concept:purchase_request",
      "alias": "PR",
      "language": "en",
      "confidence": 0.9
    }
  ],
  "mappings": [
    {
      "id": "map:purchase_request.table",
      "type": "mapping",
      "ontology_element_id": "concept:purchase_request",
      "source_element": "purchase_request",
      "source_type": "database",
      "mapping_type": "exact",
      "evidence_refs": [
        "ev:ddl.purchase_request"
      ],
      "confidence": 0.96
    }
  ],
  "conflicts": [
    {
      "id": "conflict:amount_name",
      "type": "conflict",
      "description": "Document calls it total amount while DDL uses amount.",
      "involved_ids": [
        "attr:purchase_request.amount"
      ],
      "severity": "low",
      "resolution_status": "needs_human_review",
      "confidence": 0.6
    }
  ],
  "uncertainties": [
    {
      "id": "uncertainty:supplier_optional",
      "type": "uncertainty",
      "target_id": "rel:purchase_request.supplier",
      "description": "Supplier may be optional before approval.",
      "needs_human_review": true,
      "confidence": 0.45
    }
  ],
  "evidence_refs": [
    "ev:ddl.purchase_request"
  ],
  "confidence": 0.86,
  "provenance": {
    "created_by": "example",
    "created_at": "2026-07-03T00:00:00Z",
    "method": "manual"
  }
}
